{
  "actor": "system",
  "system": "hhi_runtime_enforcement_engine",
  "session_id": "runtime-session",
  "trace_id": "runtime-trace",
  "workspace": "standards_library",
  "decision_boundary": "LOCK_MANIFEST",
  "behavioral_drift_score": 0.0,
  "action": "BLOCK",
  "violation_type": "RUNTIME_BYPASS",
  "severity": "LEVEL_4",
  "escalation_level": "BLOCK",
  "intervention_status": "REQUIRED",
  "stop_authority": false,
  "outcome": "DENIED",
  "runtime_source": "runtime_enforcement_engine",
  "event_id": "a5398e04-da9e-48c3-a031-b36cbd14f6a5",
  "timestamp": "2026-05-17T03:31:21.839539Z",
  "evidence_hash": "sha256:836f02ad299e3e36ed57fd9bd92ab46e0e35f7a836fee53d5798d87c9f138c35"
}
