{
  "actor": "system",
  "system": "hhi_runtime_enforcement_engine",
  "session_id": "demo-session",
  "trace_id": "demo-trace",
  "workspace": "standards_library",
  "decision_boundary": "LOCK_MANIFEST",
  "behavioral_drift_score": 0.0,
  "action": "ALLOW",
  "severity": "LEVEL_1",
  "escalation_level": "NONE",
  "intervention_status": "NOT_REQUIRED",
  "stop_authority": false,
  "outcome": "APPROVED",
  "runtime_source": "runtime_enforcement_engine",
  "event_id": "e5231990-0bf0-4974-a318-cbd121c09aa3",
  "timestamp": "2026-05-17T03:14:48.152681Z",
  "evidence_hash": "sha256:d01fbf57aa4b0ba98ba757108aa8b121e26304f7943a7b4c18550566b6036596"
}
